<?xml version="1.0" encoding="utf-8"?>
<xsd:schema xmlns:xsd="http://www.w3.org/2001/XMLSchema">

<!-- 
	Nerwip - Named Entity Extraction in Wikipedia Pages
	Copyright 2011-17 Vincent Labatut et al.
	
	This file is part of Nerwip - Named Entity Extraction in Wikipedia Pages.
	
	Nerwip - Named Entity Extraction in Wikipedia Pages is free software: you can 
	redistribute it and/or modify it under the terms of the GNU General Public License 
	as published by the Free Software Foundation, either version 2 of the License, or
	(at your option) any later version.
	
	Nerwip - Named Entity Extraction in Wikipedia Pages is distributed in the hope 
	that it will be useful, but WITHOUT ANY WARRANTY; without even the implied warranty 
	of MERCHANTABILITY or FITNESS FOR A PARTICULAR PURPOSE. See the GNU General Public 
	License for more details.
	
	You should have received a copy of the GNU General Public License
	along with Nerwip - Named Entity Extraction in Wikipedia Pages.  
	If not, see <http://www.gnu.org/licenses/>.
 -->

	<xsd:group name="gGroup">
		<xsd:choice>
			<xsd:element name="text"  type="tText"/>
			<xsd:element name="group"  type="tGroup"/>
		</xsd:choice>
	</xsd:group>

	<xsd:complexType name="tGroup">
		<xsd:sequence>
			<xsd:group ref="gGroup"  maxOccurs="unbounded"/>
		</xsd:sequence>
		<xsd:attribute name="name" type="xsd:string" use="required" />
	</xsd:complexType>

	<xsd:complexType name="tText">
		<xsd:attribute name="name" type="xsd:string" use="required" />
		<xsd:attribute name="value" type="xsd:string" use="required" />
		<xsd:attribute name="tooltip" type="xsd:string" use="optional" />
	</xsd:complexType>

	<xsd:complexType name="tLanguage">
		<xsd:sequence>
			<xsd:element name="group"  type="tGroup" maxOccurs="unbounded"/>
		</xsd:sequence>
	</xsd:complexType>

	<xsd:element name="language" type="tLanguage" />

</xsd:schema>
